혈관 터지겠슴다?? 강력하신 두분의 파운이면 너무 좋았겠는걸요,크흐.... 운동 끈적끈적하게 아쥬 잘하신단 말이쥬??????,워우 강력한 파운이였을것 같아요!!?? 몸이 왜 더 강력해지신거죠!????,강한 사람 옆에 강한 사람!!! 시너지 장난 없었겠어요 진짜 ???? 고생하셨습니다 쭌님 ????,파운은 역시 극한으로 몰아줘야지 찐성공한 느낌 받는것 같아요 ???? 오늘도 고생하셨습니다!! ????,헬스에 진심인분이랑 같이하면 더 자극되구 그렇자나여 ㅠㅠ 즐겁게 파운하셔서 넘 좋으셧겟어요,아니 쭌님. 수건벗으니까 너므 훈남이시다????,???????????? 오늘 저도 가슴해요,역시 파운이 조아,크.. 역시 언제봐도 운동 참 잘하십니다???? 다리운동 느므 기대되는 부분????,가슴팔 파운은 너무 좋은거 같애요 저도 어제 했는데 좋더라구요????,두분 다 헬스에 진심이신 분들이라 이야기가 잘 통하셨나보네요???? 오늘도 고생하셨습니다????,뭐지 더 잘생겨진 느낌 뭐지..,쭌님 표정 넘 평온하네요??스퀏 영상 넘 기대해욤??,파운 너무 재밌더라구요??
,,,,,,,,,,,,,,
,,,,,,,,,,,,,,
,,,,,,,,,,,,,,
견갑 잘 뽑으시는가보면 신기방기 내일 영상 기대해야겠다??,견갑 뽑는 영상 기대됩니다!!!????,오떻게 등이랑 어깨랑 같이 할 수가 있죠???? 몸도 좋지만 체력도 좋으신거 같애요,호오오 견갑 뽑는 영상이라니???? 기대하게씀다??,쭌님은 루즈라고는 없으시다구요... 어깨운동 거의 못했는데 저 어깨잖아요 ㅋㅋㅋ??????,와우 목요일날 어깨 하구 하체 한다구요??? 벌써 기대된다..오늘은 또 얼마나 멋지게 운동하시려나!!ㅎㅎㅎ??????,대칭이 넘모좋앙,견갑 뽑는 영상 기대할게요???? 맨몸풀업 너무 멋지신데요!! ?? 오늘 핫체운동도 화이팅하세용?????? 수요일 고생 많았습니단??,"쭌님 풀업기계예요??? 와 믓찌다,,",견갑뽑는 영상 언제 업로드되요???????? 제발여 빨리여??????,저는 이번주는 엄청 빨리 지나간고같은뎅??,와 풀업진짜 예술??????,광배가 어디꺼지나오는거에요 ??????대다나다,쇼츠영상에서 열심히 잘보고 있습니다 ㅋㅋ 수첩에 적어가면서 ㅋㅋ 열심히 루틴 숙지중입니닷 ㅎㅎ,좀더 화이팅하시져??????
원암으로 컬 30키로가 들리나요……..?????,아니 원암덤벨 30키로요…? 역시 강력한 팔은 괜히 나오는게 아녔어… 에이치덱스 협찬이라니 대박인데요????,우와???? 쭌님이 입으시니까 완전 찰떡소화 하셨는데요??? 너무 잘 어울리세요!!??,누군가의 바벨컬 무게가 누군가에겐 덤벨컬의 무게군요...,?????? 이두 점점더 커지시네요??,옷 너무 잘어울리세요???? 저도 사고싶네요?? 덤벨컬 중량 무슨일이죠ㅎㅎㅎㅎㅎ,덤벨컬 지금 30키로애요???????저 잘 못본거 아니죠?????,덤벨컬 30 이라고요?,볼때마다 느끼지만 프리웨이트를 머신해서 하는 것처럼 안정감이 느껴지네요. 대단하십니다.,hdex 모델 쭌님으로 바꿔야하는거 아니냐구요 ???????? 완벽 머슬핏,오우 역시 쭈니님이 입으니 옷이삽니디^^,와 흐득스 협찬도 받으시고 몸도 얼굴도 잘생기셔서 이제 유명 스포츠브랜드 다 오겠어요!!!!!!!!!!!,역시 마인드부터 다르십니다 체중이 낮아도 고중량 고볼륨 해내시겠다는 마인드ㄷㄷ,첫 사진 부터 강력쿠강력쿠!! 조만간 헬쭌님 보러 가야겠어요??,와 머슬핏 진짜 너무 멋진데 모델을 제대로 만났습니다…!!!????
쭌님 마스크 벗으신거 첨 보잖아요?? 잘생기면 운동 금지인데 몸까지 좋으시다니???,슬 더워지는데 하나 장만해야겠군요??,이게 누구야???? 엄훠!!!??????,오오!! 향은 어때여? 약간 쿨민트 향인가영??????,아니 바다 스프레이인데 피부가 너무 좋아서 피부에 뿌려야 할거 같애요!!,여름 필수템 바디 스프레이???? 향이 강하지 않다니 부담없이 뿌리기 좋겠어용??,준님 핵존잘 사진 업로드 정말 감사드립니다… ㅜㅜ??,와 오늘은 평소 피드랑 넘나 다른 일상x협찬피드네요 ???? 넘나 멋지십니당,와 마스크 벗으니까 세상 잘생겼구여!!!!!!!!!!!!!!!!!! ??????????,이제 뷰티 크리에이터도 접수하시는건가 크흐??????,아니 쭈니님 쇠질피드랑은 또 무드가 엄청 다르잖아요??,오오 여름템으로 좋겠네요????????,어머 이런피드 너무 좋아요?? 훈훈함에 눈이 호강하고 갑니다??,아니 맨날 얼굴보다 몸이@빛나더니 어늘은 얼굴이@빛나는 ???????? 멋져요 ????,오오.. 이거 진짜 여름 꿀템인데요!!???? 쭌님 일반인 모먼트 너무 잘생기셨어요!!!??
헤어밴드도 잘어울리시다니 저는 하나있는데 안 어울려서 안쓰게 되는????,헤어밴드도 잘 어울리시는 헬쭌님 ????안어울리시는게 없네요,헤어밴드 하시니까 머리가 더 작아보이세용??,헤어밴드도 쭌님한테 완전 찰떡이네요 안 어울리시는게 없습니다 ??,그 원피스 조로 같으심 크흐..????????????,너무잘어울리시네요 ㅎㅎ제가쓰면 웃길듯요 ㅜㅜㅠ소화능력 부러워요,쭌님께 헬스 배우고싶어요??????,맨날 슈건 뒤집어쓰는대 이거 완전 짱인데여?????,수건하시다가  밴드하니 어메리칸느낌납니다!!^-,기능뿐만 아니어 멋스러움까지???? 일석이조네요????,오오오!!! 헤어밴드 잘어울리세여!????,유튜브 잘 보고 있었는데 인스타에 딱 뜨시네요 ㅋㅋㅋㅋ 멋져용,헤어밴드기 너모 잘어울려요 쮸니쨈 (??????)?,오오 좋은 제품이네요! 저도 항상 머리땜에 고민ㅠㅠ,존잘만 쓴다는 그것??????
저도 스쿼트를 잘하고 싶은데 왜 벤치 잘하고 싶을때처럼 막 하고싶지가 않을까요??,아니 스쿼트 레그프래스 둘다 변태같이 잘하시는데 ??????????????,저도 오늘 출근 전 하체했는데 하체는 역시 너무 하기 싫어요??,스쿼트 저두 젤 어렵네요 부들부들??,내일 하체 전에 쭌님 영상보고 해야게씀다????,하체까지 정복 갑시다~???? 스쿼트 너무나 어려븐~,쭈니님 반바지?????? 멋지십니다!! 저는 쭈니님 영상보고 배우고있어요!!,쭈니님 반바지?????? 멋지십니다!! 저는 쭈니님 영상보고 배우고있어요!!,같이해요 하체 1 초 정지스쿼트 하면 도움이 많이 된다고 하더라구요,크으 핫체 깊이???? 쭌님 유툽 잘보고이씀다 흥해라흥????????,저도 잘하고싶네요 스쿼트ㅠㅠㅠ,풀스쾃 깊이가 와 저는 그냥 저렇게 앉지도 못하는데 말이죠,이제 하체까지 업그레이드..? 너무 멋져지는거 아닙니까?!,하체를 잘하고 싶다는 생각 자체가 멋지다요??,풀스쿼트 어쩜 그리 천천히 내려가시나요 ????
팔할때 이삼두가 다 들어가 있군요..? 크…저는 둘 한꺼번에 하면 힘들어서 못하겠던데…,헬쭌님이 하는 운동 영상보면 왜케 맛있게 드시는거 같을까요?? ??,와 ??폭발??일부직전!!!공감가네요 아무래도 이지바가 손목 덜무리??,저는 오늘 가슴인데 쭌님 피드보고 불태워보겠슴당????,아 3. 저도 발 저렇게 해놓고 하는데ㅋㅋㅋㅋㅋ내적친밀감 상승..??,오늘 운동 전에 보고 따라해보게씀다!!????,지렸다..??,머신이든 프리웨이트든 보는사람이 다 대리만족 얻게 만드는 쭌님… ??????,저 근질에 저 크기라니 … 너무 강력하십니다??,저희헬스장은 이지바만있어서 일자가 있으면 좋겠는데 ㅜㅜㅠ,우왕아앙 왕팔????오늘도 고생하셨어용??,쇼츠 영상 보면서 잘배우고 있습니다!! 멋있어용 인님!!,와 기구들이 .....??????,저도 이지바가 가장 그립은 잘 맞는거같아요. 케이블익스텐션도 이지바가 잘 맞아요. ??,"쌤 질문이 있는데요! 가슴이랑 팔 , 등이랑 어깨로 묶어서 하는 이유가 따로 있으신가요?!"
아니 요즘 부쩍 느끼는데 몸도 몸이지만 나날이 잘생겨지시는데요??? 미남 쭌님 추천 아르기닌 장바구니 줍줍 !! 고생하셨습니다 ????,"마카 다 떨어지면 그걸로 바꿔야겠어요! 류신, 마카, 아르기닌이라니...;;",힙쓰 넘 맛도리??긍데 살빠진거죠??몸이 더 좋아지신듯??,크흐흐흐 팔이 얼굴보다 크시넹 ???? 셀링뉴 가즈아아앙????,하체랑 가까워지셨다니... 그게 가능한 일입니까?????? 저는 언제쯤 친해지련지 ㅎㅎ..???? 운동 고생하셨어요????,오오 아르기닌 제품 협찬이라니!! 너무나 잘 어울리는 모델분께 협찬이 들어간것 같아서 더더욱 제품 가치가 돋보입니다 ????,으아 ㅋㅋㅋ 저희집 5살짜리 공주가 우연히 쭌님사진을 방금 보게되었는데 누구냐면서 멋있데여?? ㅋㅋㅋㅋㅋㅋㅋ 와,저의 로망도 저도 반바지 입고 하체하기???? 하체 가즈아,아르기닌 필요한 성분이라고 들었어요! 지금도 멋지지만 쭌님이 더 흡족하실 바디가 되시길 응원합니다??????,멋지십니다?? 저의 로망. 엉 낑기는 비키니빤스가 엉때메 낑겨 못나오는 엉 만들기?? ??,오와 류신 마카 아르기닌이 다들어있다니 좋은것만????????,류신 매카 아르기닌 좋은거 모르는분은 진실의 방으루??,오늘 아르기닌 먹고 하체 조지고 와야겠습니당??,ㅎㅔㄹ쭌님 손이 곱네요??????,저의로망반바지 입었는데 꽉 끼여가지고 반바지말려올라갈만한 다리 만들기??????
크~~~ 이두근 성장하려면 터질듯이 하면되는가용??? 어떤분들은 셋트수에 예민해하지말라고 하던데 ㅜㅜ,조명 몸을 빛나게 하는게 아니라 몸이 조명을 빛나게 했네??,일요일 파운 원정운동 가신건가요 ???? 진짜 근질 미쳐버립니다…????,인님 피드보면 과연.. 여기서 더 좋아질수가 있을까? 싶습니다????,그럼 유튜브로 배우러 가겠습니다????,마스크는 헬스장 정책인가유???,와 바디컨디션 개미챴습니다 !!!!! ??????????,와 지방이 5프로도 안되보여요,근육이랑 핏줄 갈라지는가 무엇..진짜 살다 살다 이렇게 멋진 근육과 핏불은 첨이에요??,하.. 진짜 팔에 무슨일이 있으셨던겁니까!!! 대박입니다!,와….이게 말이되는 팔뚝입니까…반만 따라가보고싶네요,팔도 뮤ㅣ찼다 ????????????,주말에 파운까지?????? 운동 고생하셨어요???? 알찬 일요일 보내셨네요!! 월욜도..화이팅..합시다..??????,새로가신 맛집 위치 공유 가능해요?? ㅋㅋㅋㅋ 몸 좋으신 분이 오셔서 사장님께서 서비스 많이 주고 싶어 했을거 같애요,이듀 알맹이 직입니다용??????
모자 잘어울리시는데용!!??조교포스 물씬~~불금 운동도 고생하셨습니당??????,걸리면 큰일나는 조교룩인데요? ㅋㅋ너무 강력해.. ????,오우 이협찬템 찰떡이세요 무섭지만 살가운조교느낌,선글라스만 끼면 완전 조교겠어요 ㅎㅎ 호루라기까지요 ㅎㅎㅎ,점점 완벽한 역삼각형이 되어가시는겁니깎??군인쮸니님,어깨 갈라지는거 저도 갖고 싶어요.. 알려주세요????,군대조교 느낌 ㅋㅋㅋㅋㅋ 풀업 교과서니까요…! 조교 느낌 낭낭.. 멋지다…,어우 모자가 너무 잘어울리세요?? 군 조교느낌 제대로시네용??,으와 페트릭웨어 협찬받는 쭈니님 ????????모자 잘어울려요!!!,쭌님 살 빠지신거 같아요?? 모자쓰니 완죤 소두셔??,모자는 모르겠고 광배근밖에 안보여요...????????????,풀업 반만 따라하고 싶습니다????,득근뽘근 쭈니쌤한테 찰떡으로 어울리는 모자에옹 (??????)? ????,모자 너무 찰떡으로 잘 어울리시잖아요 ??! 완전 쭌님 모자임 ㅋㅋㅋㅋ,성난 등근육 대박 대박..! 모자까지 함께하니까 더 멋져요??
저는 요새 하체만 집중해서 했더니 운동이 하기 싫네요...?? 아... 내일또 하체....??????,ㅎㅎ하체 땡기는 날이 이쪄!!!!! 하체 땡길 땐 하체 해야죠!!!ㅎㅎㅎ??저는 등 자극점 찾기가 젤 어려운데 등을 가장 좋아하시는군요!!ㅎㅎ,저도 스쿼트가 여러모로 어려운 것 같습니다????,하체가 땡길 수가 있나요…?????,하체라 땡긴다구요???,저도 하체 땡기는데 내일부턴 살살 해봐야겠네요????ㅋㅋㅋ 이제 허리도 많이 나아졌고..,하체가 땡기는 날이 있다니..,헬쭌님 디엠확인 부탁드려도 될지 여쭤보고 싶습니다.,근쇠포들이 땡기는대로해야조^^ 쭈니님도 등어깨좋아시는군요!!??????,하체비중이높으신듯 역시,하체 고생하셨습니다??아주 맛있게 득근하신거 같네용~~,하체가 땡긴다니… 역시 보통 헬짱이 아니고서야 그런 생각 들수가 없는데!! 대단하십니다 정말 ????,네거티브 볼때ㅏ다 감탄합니다??,하체가 땡기다니 … 진짜 말도안….고생하셨습니다????,저도 내일 핫체인데 맛있겠네요??
머리 깔끔하게 짜르고 운동하기 있습니까?? 저도 조만간 헬쭌님 헤어스타일로 해봐야겠어요 탐나네요?? 왠지 무게를 더 칠 수 있을거 같애요,팔 어쩔거야 진짜 완벽한 피지컬인데 자꾸 더 커지는 게 함정 ??????,윗가슴 더 채울곳이 있나요..?이미 가득차있어요..!????,오늘 30으로 겨우겨우 하고 왔는데 두배를 들어버리시네요????,갠차나요 ㅋㅋㅋㅋㅋ 저도 60키로 댄싱컬 됩니다 ????????,바벨컬 60!!???? 저는 40입니다????,머리도 넘나 예쁘시고 중량도 진짜… 후덜덜 합니다 진짜 중량 & 예쁜 몸 다 잡아내신 끝판왕 쭌님…??????,분명.. 바벨컬인데.. 벤치 중량을 들어오시는 인님.. 항상 보면서 감탄하고 있습니다 !!,와...... 바벨컬 60키로라니........벤치 무게 아닌가요!!! 진짜 팔 강력하시군요???????? 팔에 바늘 꽂으면 빵하고 터질것같아요!!!,팔 살짝만 건들면 터질거 같아요??????,???????? 와우...바벨컬60이라뇨,헬스의 꽃인 3대운동크~~ 보통 초보자들의 경우 어떤 포인트로 운동에 참여하면될까요??,저 팔뚝 비결은 바벨컬 60만들기였군요????,바벨컬 60... 제 밀리터리 프레스 무게;; 강력하십니다????,60kg 바벨컬이라니 ㅎㄷㄷ 합니다...! 윗가슴도 이미 너무 좋으신데요??? 오늘도 운동 너무 고생하셨습니다!
저는 핵스쿼트머신에 원판 안달아도 힘들어요 쭌님..........ㅋㅋㅋ 나약한 하체 ㅜㅜ 넘 고생하셨어요 내일도 화이팅이에요 ????,ㅋㅋㅋㅋㅋㅋㅋㅋㅋ아니 강아지 다린 너무 심한데야 지금도 강력하십니닷????,저도 빠른 시일 내에 다시 하체 할 수 있기를?????? 레그프레스 완전 깊게 하시는군요?! 배워갑니다??,어머나 마지막 댕댕이사진에 시선을 빼앗겨버렸네요?? 간식을 원하는 눈빛인가요?????,바벨 무게 진짜 다른것 같은거 공감!! 저도 가끔씩 체감상 더 무겁거나 가볍거나 그런 느낌이 들더라고요 ???? 오늘 핫체 고생하셨습니다!!,ㅋㅋㅋ솔까 강아지 다린 아니예요?? 강쥐는 넘 귀여븐데용??,강아지가 귀여워요??,저 강아지 아빠된지 2주됬어요!! 보고있으니 시간가는줄 모르겠더라구요ㅎㅎ,악ㅋㅋㅋ쭌님ㅋㅋ아이유다리라니 말도 안된다구요?? 쭌님네 댕댕이 너무 아련한거 아닌가요????,하체지옥 다녀오셨군요 하체 잘 털고 오셨나요?,혹시 발가락으로 땅 꼬집어서 발바닥 고정하시나요????????,빈봉도 조금씩 달라용 막상 20 안되는거 많아용ㅋㅋㅋ,귀여운 강쥐 ?? 강아지는 주인이랑 다르게 슬림파군요 ㅋㅋㅋ 저도 이따 하체하러 가는데 고생하셨습니다!!,하체 하시느라 고생하셨어용!!!!마지막 강아지 사진 너무 귀여워용??????,수행능력 저보다 훨좋으신데…실제로보면 하체 두께감 좋으실것깉아요??
보통에 몇분할을 하시는가요?? 초보자들경우 몇분할이 좋을까요???,더 좋아질곳이 있나 싶을정도로 완벽에 가까우신것 같습니다 ????,크 진짜 강력하다?? 사진으로 남기니까 변화되는 모습을 한눈에 볼수있는거 같아요??,제 등이랑 좀 바꿔주세요 제발,와 씨 중량 뭔일인지 …. 미쳤슴다 역시 ???? 어깨 느낌을 떠나 생존인데요,원래도 크셨지만 더 커지신 것 같은 느낌이..!??,역시 옵티머스프레임!! 더 확장되셧습니다??????,제 팔 좀 어떻게 해쥬세요 조짐당하고싶어요 핡핡,저랑 이두 광배 바꿔요 ㅠㅠ 제발????,주말에 원정다녀오셨네요?? 조명 다른게 느껴지긴 하네요??,진짜 제 꿈은 쭌님이에요…몸이 어뜨케 이래!!!,워... 짱멋.. 다이어트 욕구 뿜뿜,볼때마다 팔이 정말 어마어마 하십니다ㅎㅎ 펌핑 전후 상완둘레가 어느정도나 되시는거죠?,와!!! 합성인줄!!더 좋아지실게 있었네요??? ????,수고하셨어여????
와… 거기 교회 어디죠?? 저도 다니고 싶네요?? 주말 잘보내세요!!,전신을 하는 날이면 왠지모르게 기분이 좋아지더라구요 저는 ㅋㅋ????,"쭌님이 다니는 교회는 다들 몸짱밖에 없으시군요,, ???? 여러명이서 가서 운동하면 너무 재밌을거같아요ㅠㅠㅠ 한번 해보고싶다!!",크리스마스에는 모두 프로틴 파티인건가 ??????,이런 운동하는 교회 오빠 형? 크…,우와 강력해 ㅜㅜㅜㅜㅜㅜ넘 보기좋은데요!!! 원정하체 넘 고생하셨습니다 헬쭌채고????,교회 동생들 최고의 센세한테 제대로 배우셨겠네??????,교회분들이 다들 몸도 좋으신데요??,교회동생들 교회에서 믿음가득한 오빠인줄알앗는데 알고보니 근육가득!!^^,전신이라니....듣기만 해도 전신이 아찔해집니다ㅋㅋ,쭌님도 교회다니시는군요?? 멋진교회오빠?? 동생들이 자랑스러워하실 것 같아요?? 오운완 고생하셨습니다??,쭌님 조명 필요없으실텐데????,몸짱들만 있네 아주 무서워요 ….. 다들 몸뚱이가 화나잇어 ??,교회오빠가 다 쭈니님 같다면....???,오 교회오빠중 가장 헬짱이실것 같은 쭌님!! 파운 엄청 재미있으셨을것 같아요 ㅎㅎㅎ 고생하셨습니다!!
역광도 뚫고 나오실 몸이신데?? 헬스장 고르는게 항상 어려워요;;,어떠케 12세트 만에 운동을 끝내지.. 12세트 안에 얼마나 많은 시련과 역경이 담겨 있을까 ??????,등을 모으는것 조차 힘드셨다니… 대체 얼마나 부신겁니까!! ???? 가슴 운동 고생하셨습니당 ????,하하..남자분이 삼각대 들고 다니는건 흔친 않더라구요??  그래도 머 눈치볼거 없쥬,오 네번째 원판으로 하는거 저거 저도 해바야겟어용 자극 좋나오 !??!,새 헬스장 갈 생각만 해도 설레는데요?! 옮기기로 결심하신 건가요?!,"삼삼데이는 삼겹살데이쥬우우 >_< 가슴운동,, 12세트유??? 쭈니쌤처럼 되려면 12세트씩 해야하는거쥬.,,?",조명이 젤 중요하죠!!?? 근데 역광이셔도 강력하실거 같은데??,손목보호대  어디껀가요??,덩치큰 삼각대 말입니까?ㅎㅎ???? 요즘 다 찍는데 괜찮습니다 ㅎㅎㅎ ??,부끄럼 많은 사람은 쉽게 옮기기 어렵죠??,등을 모으는것..자체가 힘이드는데..12세트라니..정말 늘 대단해요?? 삼겹살데이 너무 부러운걸요?? 행복한 삼겹살데이 보내구오세요!??,12세트만하면 쭌님처럼 되는거죠??이제 12세트만 하는걸로??????,역시?? 오늘도 열운 하셨군요오ㅎㅎㅎ 불금 잘 보내봅시당??,항상 열심ㅎㅣ 하시는 넘사벽 쭈니님 !! ???? 멋집니다.  홧팅 입니다. 계속 응원할께요??
숄프 기계인가요 ㅎㅎ 이러니 어깨가 좋으시지????,또 금욜이네요??  저는 낼 등운동 넘 기대되요 어깨를 할까???,저도 요며칠 많이 먹어서 회개해야하는데..ㅎㅎ 쭈니님 보면서 회개운동 다짐했숩니당?? 근육통 많을 것 같다니!! 운동이 잘 먹었나봐요??????,진짜 월요일같은 목요일이었슴당?????????? 파운 강력하게 하셔서 회개 다 되셨을듯,고생하셨습니당!!! 파운하셨으니 득근도 두배로 얻으셨을거에용!!??????,쭌님 캡모자 쓰신분인줄 알았는데…ㅋㅋㅋㅋㅋㅋ??,오디에 살이 찌셨는지 모르겠지만 회개운동하시는 모습도 멋지십니다???? 오늘도 행복한하루로 마무리하시길 바래요??,조교 선생님 무서워 보이십니다??,역시 쭈니님 대단하십니다!! 회개하기위해 용병투입! 표정에도 진심이 최고입니다^^,살이 어디쪘죠!!!!!!!! 고생하셨어요 쭌님!! ????,회개에는 파운만한게 없죠!!??????????,쭌님!!! 비니까지?? 뺏어갈 작정이십니까?!몸이 다르니 비니도 좋아보이네요????,운동볼륨 얄짤 없네요 !! 미쳤다 오버헤드프레스 ??,표정 제대로 찍히셨는데요ㅋㅋㅋㅋㅋ모든고통이 느껴지는??????????????,벌써 금요일이라니... 주말운동 못하는저는 슬픕니당????
저도 스쿼트가 편하진 않지만 자존심 때문에 버리지는 못하고 계속 하다보니 조금씩 나아짐을 느끼는 중입니다?? 다른 하체도 있지만 3대 몇? 포기할수 없잖아요 ㅎㅎㅎ,하...학다리라니 그럼 저는 소금장이...??? 쭌님 목표하시는만큼 이루시길 바래요??,학다리라니요!! 아닙니다 아니에요 인정 모태..! 핵스쿼트 할 때 폴롤러 정말 생각도 못했는데???? 담에 꼭 폼롤러 끼고 해봐야게써요!!,아니 대체 누가 학다리일까요 …… 진짜 기만입니다 선생님 ????,오…꿀팁..! 어뜨케 학다리에요!! 아닐텐데???? ㅋㅌㅋㅋ 스쿼트가 제일 재밌긴 해요…그 재밌는거 저는 당분간 못해요…,저도 진짜 다른 핫체운동으로 대체해서라도 스쿼트는 안하고 싶은데 이게 참… 마력이 있습니다 스쿼트는 ???? 헬요일 고생하셨습니다!!,오..? 핵스쿼트 폼롤러는 생각 못했는데 완전 꿀팁이네요???? 저도 허리디스크때문에 스쿼트는 절대 못하는데 한번 도전해봐야겠어요..????,집에있는 반바지 다 갖다 버려야갰넹???? 스쿼트 진짜 하기싫긴한대 또 하이바로 풀스퀏 하시는거 보면은 욕구를 참을수가 없..??????,스쿼트 저도 첨엔 하기 싫었는데 이젠 슬슬 재밌어지려구 해용!??????,ㅈㅓ 무게를 들 수 있는 쭌쌤 멋있뀨 부러워영 ?(????)?“ 제가 들면 깔리겠죠?!? 저 무게를@들 수 있는 그날 까쥐 ???? 득근득근,핫체 오히려 레그프레스가 잘먹던데 그래도 스퀏 온몸운동 놓칠수 엄쬬??,진짜 가동범위와 운동 집중력의 달인???,학다리 절대 못참쬬?? 여름되기 전까지 더 조져봅시다??,이미 강력하신데!!^^ 쭌님 저 당직때 유튜보는데 숏츠에서 나와서 와 제 인친이예요 햇슴다??????,
저 대회 나가는 날 팔쫌 빌려 주세요 ㅠㅠ 몸도 빌려주시면 감사하구요!!,몸이 덮였다는게 근육으로 덮였다는 그말이신거죠!? ㅎㅎ 행복 주말 되세요????,어깨에 하체.. 진짜 강력하십니다????쭌님도 주말 잘 보내셨나용?? 벌써 월요일이지만 ..화이팅합시당??????,데피/컨디셔닝/매스 전부다 부럽????,준님 여기서 식단까지 하시면 난리나는거 아니냐구요????,일주일에 하체 두번 가져가세요?,맛있는거 드시면서 주말 잘 보내셨는지용?????,와 바디컨디션 개미쳤어요 ! ㄱ??????????,와 오늘 오헤프 30으로 하면서 힘들다했던 나 자신 반성해??,"와 어깨랑 하체랑 같이 하시다니 정말 대단해야 쭈니쌤,,저는하체만 하면 달아나고싶은 심정이 가득 가득??",운동하는 남자는 옳다! ㆅㆅ 선팔하고 갑니당 소통해요 :),쭌님 햄볶한 주말 보내세요!! 요즘 유툽도 활동하시더라구요????????,쭈니님 유튭구독자 금방 늘어나네요!!????,아니~~ 어떻게 하면 인친님처럼 어깨 생기나요 ??????????,
