너무 한적한 위치네요 숙소앞 바로 바다인거예요?!북적거리는게 내키지 않았는데 너무 좋은 정보네요~^^,와… 새밍님 덕에 근 10년전 하와이 숙소를 다 보네요..ㅎㅎ 신기방기 ㅋㅋㅋ 제 허니문호텔이었어요..ㅋㅋㅋㅋ 로비에 나던 향 늠 좋았는디.. 요기 로비책장문 밀면 클럽으로 변하는거 아직도 있을랑가..😂😂❤️🔥,덕분에 너무너무 힐링하고 이씀니다🥹,하와이에 강남스타일이..!ㅋㅋ😮 정보감사해요🤍🤍 메모메모!!!,사진보며 대리만족 중이에요 .고딩때 가족들이랑 갔었는데 기억도 안난다는😂😂,아쉽지만 하와이에서는 5성급이더라도 호텔 컨디션 기대하면 안됩니다😇 저도 리노베이션 한 곳 갔는데 하와이 가시는 분들은 호텔은 기대 안하시는 편이 좋은데 아무래도 비용이 싸지 않다 보니🥲,"더 모던 진짜 너무 좋죠,,! 진짜 가성비 끝장판,,🥹🥹",당장 하와이 날아가고 싶네요😍❤️,11월 하와이 예정인데 정보 감사합니다❤️,"7,8번째 사진 장소 알 수 잇을까용!?😀","혹시 금요일 불꽃놀이나 호텔 내에 스파는 가셨을까요? 저희 내년 1월에 가는데, 숙소 여러개를 가볼 생각이라..실제 후기가 궁금해서요 🤍",@ryuuuuuu_1019 ㅋㅋㅋㅋ,@jjang_072,@h__dun,
마우이는 간 지 넘 오래돼서 덕분에 추억여행 했네요 ❤️,너무예뻐서 홀리겠어요🥹,힝 너뮤 이뿝니다...!❤️,너무 예쁜 밤🌙 행복한 시간 보내고 오세요~,실루엣 마저도 넘 예쁜그… 🫰🏻✨,너무 예뻐요❤️ 당장 떠나고 싶네요😍,✨,캐리어에 숨어갈걸...,❤️,,,,,,
아이폰기본카메라가 ..지금 이렇다는건가요 ??ㅋㅋ신행때 하와이 다녀왔눈데 ..마우이 좋죠 …ㅠ,신행으로 마우이+오하우 갔던거 생각하며 별샘님 스토리랑 게시글 실시간 업뎃 사수해요..🩵 저도 부기보드 한참을 탔었는데 진짜 재밌던 기억이 나네요!!! 🥹,우왘..진짜 너무 좋으시겠댜...🩵사진으로 힐링 합니다🦭🩵,와 멋져요💕💕,"와,,,날씨 무엇😍😍 부럽다,,,,대리힐링하고 가요❣️",보기만 해도 힐링이네요 😍,,,,,,,,,
다시 가면 되지만 쩜 아쉽네요.. 저도 올라가는 길에 비가 억수로 쏟아져서 망했다 싶었는데(안개까지 더해서 너무 무섭) 올라가서 거짓말같이 무지개 등장하면서 개었답니다.. 발 아래 구름이 😍 할레아칼라가 제일 기억에 남아요👍내려오는 길에 본 별까지..별이 그냥 막 쏟아져요..,세상 행복해보여욤...🤍,마우이 너어무 좋죠 전 두살 아들 데리고 할레아칼라 다녀왔답니다^^,보기만 해도 행복하네요❤️,별샘님 탑 너무 귀여워용 탑 정보 알랴주세용❤️❤️,"안녕하세요? 죄송하지만, 하트 목걸이 정보 여쭈어도 되나요?😂😂",마우이보다 별샘님만 보이는😍,,,,,,,,
할레이칼라 가시죠ㅠㅠ!? 꼭 다녀오세요.. 마우이 너무좋아요 전 딱 1년전에 다녀왔었는데 아사히볼이랑 로코모코 다 너무 그립네요~,많이올려주세용 구경만해도 좋내요 ㅠㅠ,와… 영상화질 무엇..😮😮 너무 황홀한뷰입니더 ..🤍🌷,와... 별샘님 ㅋㅋ 저도 대리만족중입니더ㅜㅜㅜ 너무너무 그림같아요🩵🩵,그럼요 마구마구 도배해주세요😍,와🥹 사진으로 이정도면 실제론 얼마나 예쁠지…🤍,🏝️,오!!!!! 저도 빨랑 바꿔야겠어요 사진첩 정리도 하고 ㅎㅎㅎㅎㅎ 하와이 🌺 갈 준비할게 많아요 ㅎㅎㅎ,하와이 도배는 와이낫!!!! 😍 아 너무 좋아보여요 아악,우와❤️ 아름다운 공간과 좋은 카메라가 만나니 사진이 너무 예뻐요😍 사진 많이 많이 올려주세요❤️,하와이 너무 예쁜보석 같네요😊,아뉘@안올리수가 없잖아요😍😍😍😍,"천국이니,, 별이 많은게 천국 맞구만🥺",더더 올려주세요😍,더올려주세요 대리힐링 핸복캐요🫧🤍 근데 이거 14프로로 찍으신거에요 샘님?.. 와.. 화질무엇이죠!...?✨
바지 정보가 궁금합니다 !!🥹💛,하와이 여행 계획하는데..자유여행 가신거죠? 부모님모시고 가기에도 좋은가요? 어떻게 일정짜셨는지-.,어머머 수영장 보니깐 너어어무 좋은데요 😍,하와이 너무 많이올라서 ㅜㅜ휴,안다즈 마우이는 살앙입니다! 솔지키 음식 맛은 별로인데 프라이빗 비치는 아름다움 그 자체! 저는 프비에서 거북이도 보았어요👏,12월 예정인데 12월이 제일 비싸다니요.😢,@na.yooon,,,,,,,,
혹시 휴지 공구는 언제쯤 할까요? 여행중이신데 죄송함다......,여전하네요~~ 넘 좋죠 다시 가고프네용😢,아 영상만 봐도 진짜 하와이 최고야...💙💙💙,🏝️,우와❤️ 너무 아름답네요😍,안다즈는 여전히 아름답네요...🥹🫧🤍,하와이 여행 계획중인데 많이 올려주세요~~~😍,하와이는 공항에서 흘러나오는 음악부터 설레게하는💚💚,와 이거보니 하와이 꼭 가보고 싶어지네요🩵,헉쓰베리 넘 예뻐요 ㅜㅜ 여기 숙소 넘 가고싶은데 정보좀 알려주세용!!🙌,ㅋㅋㅋㅋㅋㅋㅋㅋㅋㅋㅋ 하… 하와이 앓이 다시 시작이요😍,저는 6월달에 하와이 🌺가는데 너무 기대되요 💙,크👏👏👏 영상만봐도힐링인데 직접 눈에담으면얼마나감동일까용❤️😍,와 너무 예뻐요ㅜㅜ 화질 무엇👍🏻👍🏻 영상 사과폰으로 찍으신건가요?,Andaz Maui 는 사랑이죠 🫶🏻 @eugenee84
테그안되어있는 옷들 정보 알고싶어요ㅜㅜ특히 네번째 끝나시요 ㅠㅠ,샥스코브 스노클링 추천합니다. 저도 다녀온지 얼마안되서 설렘이 고스란히 전해지네요~😍,분홍보자에 회색맨투맨에 분홍바지 그리고 백팩🤍🤍 너무 귀욤🌸,"지난주에 다녀왔는데 ㅠ  마우이랑 오아후로.. 마우이는 할레아칼라 일몰 꼭꼭, 블랙락비치, 호오키파 비치, 하나로드.. 오아후는 코올리나비치 라군, 래니카이 비치(하와이어로 천국의 바다), 와이키키는 당연가실테고, 다이아몬드헤드.. 하나우마베이는 예약이 어려워서 실패했는데 도전해보세요",아니.. 코디컷 무슨일ㅠㅠㅜ 하트목걸이 정보 주실수있나요!!!,안녕하세요!! 혹시 그레이 맨투맨에 분홍바지 정보 좀 알 수있을까요????😍,"핑크모자,,색감 너무 제스타일인데 ..혹시 가능하시면 알려주실수 있을까요 ??🥹",4번째 사진 탑 정보 좀 알 수 있을까요?😮😍,"3,4 뷔스티에탑 좌표 좀 찍어주실수…",아놔 별샘님 피드보고 후아힌 엊그제 다녀왔는데 이러다간 하와이도 예약할것 같아요..😂힣 잘 다녀오세요❤️사진 마늬마늬,따라가고싶어요😍,조심히 다녀와🩷🩷🩷,오하우 맛집 디엠 드릴께여 ㅎㅎ,호텔은 이미 예약하셨겠지만 안다즈 마우이 수영장 예술이고요😂 도보로 가능한 거리에 와일레아아울렛 안에 있는 루스크리스 스테이크!!!!! 진짜진짜 인생 스테이크 였습니다🔥❤️,우왕 역시 옷들이 다 너무 예뻐요 행복한여행 되세요😍
@jypjyppp 이뿌다❤️,@ii_lsy_09_ii  이든이이거사줄까?!?!,,,,,,,,,,,,,
욕조위에 있는 우드 트레이 어디껀지 알수 있을까요? 😍,중간 쪼롱이 넘 이쁘구..😍 굿밤되셔요 새밍님:)🕊️,디엠 한 번 확인 부탁드려용 ❤️,이번에 베이지크 선크림도 같이 올까요?? 궁금해용,안녕하세요~ 텀블러 정보 알 수 있을까요?^^,,,,,,,,,,
혹시 마와 공구는 언제일까요?🥲,혹시.. 마누카꿀이랑 베이지크는 또 안 하시나요 ㅎㅎㅎㅎ😂😂,유통기한 있나요?😄,"안녕하세요 마와 옷걸이 또 공구예정 있으실까요, 언제쯤 가능한지 여쭤봐요 :)",혹시 오늘 주문하면 내일 바로 출발할까용??,딴 얘기지만 피자 너무 맛나여,이벤트로 받진 않았지만 본품5개+리필3개 구매했어요 ㅎㅎ 향이 맘에 들기를😍,별샘님 사쉐 정말 예뻐요 :) 여성스러운데 뭔가 또 귀엽고..😌,리본으로 묶어 걸어주니 너무 예뻐요🥰,집들이 선물로 사둔 샤쉐를 신랑이 자기방에 필요하다고해서 바로 뜯어 걸어두네요 향이 진짜 좋아요!!! 신랑말 듣길 잘했어요👏,,,,,
요상하게 비샘님껀 자꾸 믿고 사게되네요😂 신랑차에 놓으려고 구매했는데 사다보니 제차 어무니차에 다 놓게되겠어용 ㅎ,향은 몇 개월 정도 지속될까요?,으악 저희 생활공작소 제습제 언제 공구 하시나요? 놓쳤네요ㅠ,다른이야기지만 혹시 옷걸이는 언제쯤 예정일까용?🙏🏻,사쉐 다음 공구는 언제쯤인가요?😮,향이 무슨향 일까요? 시중에 있는거랑 비교한다면 흡사한 향이 뭘까요…,집들이 선물로 구매했어요❤️,,,,,,,,
혹시 이 샤쉐가 파뉴에서 판매하던건가요?,꺅 너무 감사합니다 ... 🦦🤍🤍🤍,,,,,,,,,,,,,
일리쓰다 네스프레소로 넘어오는 사람들 많다고 하셨는데 저도 일리쓰다 넘어왔습니당… 일리만의 매력이 있듯이 네스프레소의 매력에 푹 빠져서 헤어나오질 못하고있어요 ㅋㅋㅋ 디카페인 못잃은사람인데 네스프레소 디카페인 왜이렇게 맛나쥬? 추천해주신 디카페인도 꼭 먹어봐야겠어요🖤,저도 주문해서 마시고있는데 커피다추출하고나서 뚜껑열면 캡슐이 뒤에 통으로 넘가는거 맞죠?  제꺼는 계속 뒤로 안넘어가구 남아있어서 불량인걸까요? 😢,주말간식 딱!이네욤~😋😋 목빠지게 기다리고 있어요옹❤️❤️❤️,"테스트겸 하나 써보았는데 뚜껑열면서 나사가 하나빠졌는데 어제 문의를 오전,오후 두번이나 드렸는데 아직 연락이 없어요 응대가 빠르지 않네요 지금 쓰지도 못하고 화가 나네요 환불 원합니다",아이스아메할때  물을 얼마정도 해야 맛있을까요??😢 물 양 맞추는게 좀 어렵네요 😅,버추오팝 재진행 예정 있으실까요??,버츄오팝 주문해서 잘마시고 있어요.^^ 잉글리쉬머핀은 어디서사나용?,별샘님 후라이팬은 어디꺼야요? 😍,,,,,,,
기계고장으로 교환을 하려고하니 네스프레소에서 결제내역을 요구하길래 카드결제기록를 보니 공구라서 내역이 네소프레소로 확인이 되지 않아 교환신청이 어렵다고 합니다. 혹시 버추오공구사이트링크를 다시 열어주시거나 결제내역을 확인할 수 있도록 도와주세요,전..벌써왔는거있죠🫣🫣지금외출중이라 못펼쳐보고..내일가서 풀어봐야죵❤️,컬러도 상큼해요🧡🧡,주문하고 기다리고 있어요~한동안 버츄오 사용 못했는데 넘 좋아요!! 알티시오랑 더블에스프레소 스쿠로 매니아입니다ㅎㅎ,오늘 배송 받아서 청소까지 완료했어요!! 바로 써봤더니 비오는 날 커피향 집에서 폴폴.. 너무 좋네용 ❤️❤️❤️,혹시 버츄오 플러스와의 차이점이 뭘까요? ( 아 그리고 자동레버 수동레버가 무슨 말인지 모르겠어서요…😢 알려주시면 감사하겟습니당),웰컴기프트 캡슐 포함인가요?,디자인도 심플하고 넘 이쁘네요😍,As 건때문에요,집에 택배가 도착했다고해서 얼른 집으로 달려가고싶네요 😂😂 내일저녁에나 집에 도착할거같은데 궁금궁금 ㅋㅋㅋ,안녕하세요. 정품등록하려는데 자꾸 날짜를 다시확인하라고 뜨는데 공구상품은 정품등록이 안되나요???,혹시 또 공구 언제 진행하세요!,저 화이트 주문했는데 레드가 왔어요. 디엠으로 이름과 연락처 보내놨습니다. 교환방법 부탁드립니다~,여행중이었어서 이제 집에와서 열어보니 제품하자있네요. 네스프레소 상담톡인가요? ㅜ,구매영수증좀 받아야 하는데요 연락 부탁드립니다
어디서 구매가 된건지 모르겠어요.  새로 산건데. 밑에 고무 하나 빠져있는 하자가 와서 며칠째 사용도 못하고 일단 그대로 두고 있습니다,불량문의는 네스프레소로 직접 문의하면 될까요??,꺅❤️😍😍이벵발표했네요~ ㅎ신랑한테큰소리떵떵쳤는데😂😂.있는거아직괜찮은데..또사냐고해서ㅋ여튼~ 크래마가장난아니네요😍얼른캡슐더사야겠엉요❤️❤️,캡슐커피 가격대는 어떻게될까요?,다음에도 공구 또 있을까요....?ㅠㅠ,꺅❤️ 당첨요? 넘 감사합니다. 어린이날 선물을 제가 받았네요 😍,머신 그만 사용하자할 때 전원 off하지 않고 그냥 플러그 뽑으면 될까요? ㅎㅎ,주문완료했어요❤️😍기대중입니다,우와 ❤️❤️ 요런 팁 까지 최고예요,안녕하세요. 구입했고 밑에 고무가 하나 빠져있어서 상담 요청 해놓은 상태인데요. 연락이 안와서요. 문의를 다시 어디다 드리면 될까요?,청소할 때 수돗물로 해도 되나요? 집에 정수기가 없어성😂,네스프레소 버츄오 팝 머신 설명도 너무 잘 해주시고 센스만점으로 캡츌 추천 글도 올려주셨는데 … 이렇게 머신 관리 방법까지 하나하나 세세하게 올려주셔서 너무 좋아요 !!! 🤍어제 구매했는데 오늘 곧 온다고 해서 너무너무 설레는 마음으로 기다리고있답니다 :)받자마자 요 영상보고 청소 싸악해서 사용해봐야겠어용 ☕️,저 팝 구매했는데 플러스랑 커피맛 차이도 나는지 궁금해요 ㅠㅠ수동개폐라 혹시 많이 불편하진 않을까요???,머신오자마자 청소법 따라한다고 바쁘게 이것저것하다보니 당첨된것도 모르고 이제봤어요😍감사합니다,@yongsik_1109 자기 할 일
"아이스포르테(230ml) , 스쿠로(80ml) 왕추천 ⭐️⭐️⭐️⭐️⭐️입니당 !! 둘다 산미없고 버디감도 꽤 있눈편이라 너무 고소해요 ㅠㅠ 아이스포르테는 230미리라 너무 많다고 생각했는데 별샘님처럼 중간에 정지 버튼 누르면 되는 그 좋은방법을 왜 지금 알았을까요...? 스쿠로는 80미리라서 물 많이 타서 아아 뜨아 취향에 맞게 드심 됩나더🤍",저도 산미 없는 커피 좋아하는데☕ 저는 개인적으로 환경에 아주 관심이 많아서 사실 캡슐 커피 고민 많이 했었는데 캡슐 커피 뿐 아니라 커피 산업 자체가 환경오염 많이 시킨다고 해요🥲(근데 저는 안타깝게도 카페인 중독🫠) 근데 네스프레소는 환경에도 관심을 갖고 있어서 이번에 구매했어요🫶🏻 스벅도 그린워싱이라고 말 많지만 그래도 저는 안하는 것보다 작은 실천이더라도 하는 게 낫다 주의라 물론 개인의 생각은 다 다를 수 있지만요💚,별님~~~따뜻한 물에 캡슐 원액을 내리신거죠?,선착순 증정은 끝났나요? 일하느라 퇴근길인데 지금봤어요😢,블로그 댓글 확인 해주세여😢,바코드 읽어서 자동으로 세팅되어 나온다던데 버튼이 에스프레소 추출버튼만 있는거죠? 물 안타면 무조건 에스프레소고 아메리카노 먹으려면 물타서 먹으면 되는가요? 궁금해요😆,와.. 진짜 매장에 놓을 커피머신 찾고 있었는데 타이밍 갓벽...♥️ 당장구매 하꺼에요.,별샘님 입맛이랑 같아서 추천해주신 캡슐로 먹어봐야겠어용 꿀팁 감사합니당🩵 다른분들이 댓글로 추천 해주신것도 바로 메모 했답니당 다들 감사합니당🫶🏻🙏🏻,머신 받고 바로 세척해야되는거 같은데 그 영상도 찍어주세용❤️,❤️구매완료❤️내일부터 집에 없어서 일부러 2시이후에 결제해야지 해놓고 깜박할뻔했네요. 화이트가 아직남아있어서 얼마나 다행인지요 😍😍,☕️☕️☕️,이거 이제 구매 안 되나요? ㅜㅜ,산미없는커피 좋아하시면 일카페 랑 알티시오 너무 추천이요 ❤️ 저도 산미싫어하는사람중 한명인데 일카페 완전 정착했어요😍,11시4분 결제했는데 배송중이겠져?😂,구매했습니다 😍혹시 자동 청소 기능이 있나요? 중간 중간 청소는 어떻게 해야 할까요?
어버이날 선물로 코코넛 화이트 구매완료🩶,색감 크림 너무 고급스럽고 예뻐요 별샘님 :),코타화이트로 구매완료🤍 예전부터 일리랑 네스프레소 커피머신 사이에서 고민많이했는데 별샘님 덕분에 다시없을 가격으로 네스프레소 팝 구매했어요❤️너무너무 기대됩니다🤩🤩,"라티시마도 청소가 불편해서 고이 모셔두고 안썼는데 ...버츄오는 사랑❤️ 저 테스트캡슐 1일3커피 해서 추가캡슐 주문도 했네요 캡슐 여러개 먹어보고 차이있을까 크기비교, 캡슐가격 비교, 도착하자마자 지인들한테 마구마구 추천했어요 커피향도 퍼지구 크래마가 달라요달라 크림드간커피매니아인데 전~혀 카페 생각안납니당❤️",구매했어요🩵 사놓고 방치하면 어쩌지 고민하다가 그래도 크레마풍부한 커피맛 너무 궁금해서 주문했어용 매일매일 손이 가도록^^,앗 구매완료 댓글은 여기였네요 ❤️구매완료❤️ 언제나 믿고 사는 별샘 공구제품이죠. 냉장고에서 떨어지지않게 쟁여놓는 피자다나 부타 지난번 마와옷걸이도 너무 좋아서 다음공구 기다리잖아요 ㅋㅋ 커피머신은 나중에 브레빌 살 생각에 안들이고 있는데 버츄오팝은 올려주시는 게시글들이 사람마음을 움직이네요 ㅋㅋㅋ 지금 여행중인데 집에 돌아가면 도착해 있겠죠? 😍😍,11시 출산하러 들어가는 언니가 마지막으로 한 부탁이.....버츄오팝 주문해달라는거였어요! 11시정각 알람맞추고 구매완료입니다♥️,구매완료❤️,고민하다가 구매완료❤️❤️ 버츄오도 이 기회에 입문 합니동🫶🏻,반자동커피머신 사용하다가 방치된지...1년째😂🤣 출산하며 더 사용하기 힘들어질 것 같아서 캡슐머신으로 구매했어요! 일리-드롱기를 거쳐 마지막 커피머신이 되기를🙏🏻,구매완료하였어여. 캡슐은  안들어있죠???,구매완료☕️ 일리 물통을 놓쳐서 깨트리는바람에 구매하려고 보니까 물통이 4만원이에요!?😮 기회다 머신을 바꾸자 하던 찰나에 공구!! 네스프레소 머신중 타캡슐 호환 되는 제품으로 구매할까 보던 중 공구 보고 버츄오 캡슐만으로도 종류가 많아 팝으로 11시 땡 하자마자 주문했어요😌,빠른배송 받고 싶어서 오후2시전 막차 탔습니다 :)🤎 구매완료 .ᐟ.ᐟ 코코넛 화이트 색상 완전 심장저격 😮💘🫶🏻🫶🏻🫶🏻,"@moonjung__ 너의 스토리를 보고 허겁지겁 질러버림,,,🤦🏻‍♀️🙊🤦🏻‍♀️🥹 구매완료🩵🩵",@hy0.ni 이효니 구매 완료..🤍 기획전 끝나기 전에 사야한다며 파리 여행중인 친구꺼까지 같이 구매해주셨어요 🥹🫶🏻
스트라이프는 질리지 않고 예쁜것 같아요❤️ 솜이 두꺼워서 좋네요😆내 손은 내가 지켜야죠🙌,더러워지면 세탁은 어떻게 하나요? 세탁기 돌려도 되나요???😮,언제까지 오픈이에요?,,,,,,,,,,,,
구매예정인데 리뷰 보니 불량 또는 고장이 좀 많은것 같더라구요😢 이런경우 AS는 백화점 통해서도 되나요?,블랙이랑 화이트 너무 고민이 되네요 오픈시간 알람 마춰놔야겠어요 ㅎㅎ 혹시 가지고 해외 가면 그 나라 네스프레소에서도 a/s 가능하신가요?,코피 너무 쫀쫀한대용 ? 🤍,머그컵은 선착순인가요? 올화이트 일리 사려고 했는데 흔들리네요😍,이거 버츄오 캡슐은 용량 상관없이 다 호환되는거죠?? 🥹 기계 하나 더 필요한데 무조건 사야겠어요… !,알림이용,안녕하세요! 혹시 옆에살짝보이는 그릇건조대 구매처 알 수 있을까요? 다른피드에서봐도 깔끔하고 예뻐서요오❤️,망고 옐로우는  구매 안되는거죠?,혹시 커피캡슐 다른 제퓸들과 호환되나요? 😀,릴스속 아이스컵은 어디껄까요?,알림대기중❤️❤️,A/S는 가능한가욥??😮😮,알림이요,알림이요,@jo_ong130 이거살거얍
헛 1401의 포근한 쇼파같아요!!💕 은은하고 심플하면서도 갬성이넘치는! 🤍 ☁️ ☁️ ☁️ 🤍,🩵🤍🛌🧺🫧⛅️🌤️☀️☀️ 🧺🫧🛌🧼🫧🫧🫧🤍🩵,,,,,,,,,,,,,
"와, 가격 증말 대박적이네요!! 👏 번외 질문인데 샘님 베이지크는 언제… 🤣😂🙏🏻",참여완료❤️ 아니 버츄오는.. 진짜 최근에 유튜브 광고 보고 오 신상 장놘아니쟈나… 했던건데 샘님이 진행하신다는 거 보고 증말 놀랠노자네쏘가 공구를? 이라는 생각도 들었는데 뭐랄까… 급이 다르구나 라는 생각을 좀 했다고요🫣 그냥 캡슐 넣는 게 아니고 알아서 인식한다는 부분에서.. 갬덩스.. 무튼 이벤트도 매번 열어주셔서 감사할따름❤️늦게 입덕해서.. 찐으로 챙겨보는 중이고요💕,오!! 버츄오 예전에 썼었는데 팝은 미니미니한 느낌😍 마니 귀여운데요?❤️❤️,갑자기이것을본것은😮운명인건가~ㅋㅋ저희집 일리머신지금맛탱이갈려해서.본체바닥에물이 흥건;😢그래서 다른거지금보고있는데..카*새로나온것도괜찮은가보고있는데 1401홈님...버츄오팝이라니😍..네스프레소는친구집에서 먹어본기억에 좀..사약같은😂😂맛이였어서 그때 일리를구매했던기억~^^캡슐마다틀리겠지만 버츄오~맛있었던기억이나요(펜션에서먹은기억)팝은.어떨지...하~고민고민되네요👏👏어쨌든. 가격매력있구요~❤️❤️.,참여완료 🙌 버츄오의 미니버전인가요?? 귀여워요,❤️참여완료❤️ 셋째 임신했을때 커피 줄여보겠다며 집에있던 머신기 팔았는데 밖에서 사먹었다죠???😮 친구가 버츄오 추천해서 사야지사야지 하다가 뱃속에 있던 그 세찌가 오늘 돌이네요? 장기 육휴자는 애들건 고민없이 사도 내물건은 고민만 하다가 시간만가요 😅😅😅 오늘 세찌 첫돌인데 나자신한테 선물하고샆네요. 고생했다고 그리고 앞으로도 잘해보자고 ❤️❤️❤️❤️❤️,버츄오캡슐이면 다른회사캡슐은 호환이안되겠쥬~~?,캡슐커피인데도 이리 찐~하고 맛나 보이다닝!!! 저희집 1401home 식탁과 찰떡일 거 같아요❤️❤️❤️,참여완료 ❤️❤️ 고민하던차에 이런소식이라니🥳,저도 브레빌 쓰기전에 네스프레소 썼었어용 ㅎㅎ,참여완료🔥🔥🔥아니!! 캡슐도 아니고 머신 이벤트라뇨!!!!😍😍😍,🤍참여완료🤍곧 복직하는 지호맘 ! 매일아침 커피한잔으로 시작할래요! 네스프레소 버츄오팝이라니➰미니카페가 생긴것 같은 기분일것 같네요!! 지호맘에게 와주세요✨,"참여완료 🤎 캡슐머신, 특히 네쏘를 좋아해서, 시티즈랑 버츄오 있는데, 버츄오팝 너무너무 궁금해요!! ☕️ 요즘, 릴스 만드는 재미에 빠졌는데, 예쁜 후기도 남겨 볼게요 !!",❤️참여완료❤️ 애기낳고 이제 커피좀 제대로 마셔보고싶다ㅋㅋㅋㅋㅋㅋ,@pyaelimi 참여완료❤️신혼집 입주 예정에 안그래도 버츄오 구매할 예정이였는데 이런 이벤트도 네쏘랑 협업이라니🥰정말 너무 가지고 싶네요🔥인테리어까지 포기못하는 1인에게 버츄오팝 너무 예뻐요!!!!!!!!!!!!
또 언제 오픈하실까요?🫣,지난번 공구 때 페퍼로니로 가득 쟁여뒀다가 이번엔 고르곤졸라랑 포르마지오로 시켜봤어요! 에어프라이기에 돌리면 진짜 화덕에서 갓 나온 맛...........🥹,오오 놓칠뻔 했어요😂 구매완료!! 매번 공구때마다 먹지만 진짜 맛있습니다👏,12판 받아놓고ᆢ또ᆢ구매하고픈 욕심이~~😂😂😂😂 😝😝😝😝,디엠좀 봐주세요,이거 진짜 냉동실 비워놓고 쟁여야합니다 너무 맛있어서 감동했잖아요😂,우왕 요 피자 맛나요🍕🍕😋😋,프라이팬에도 가능한가요?,앗 놓쳤어..ㅠ,@suuunho_  냉동실좀키워죠,,,,,
상판포함 전체 다 도장되어있는 건가요?,우아 진짜 간지 간지 👏👏👏,쇼파랑 찰떡이에요! 역시 믿고 보는 별샘님 가구!,우와❤️ 디테일까지 너무 예쁘네요😍,이뿌당…❤️,혹시 실제로 볼 수 있는 쇼룸이 있나요~?,,,,,,,,,
