웨이트만 두시간 넘게 하시는건가요!!?????? 근육통이 생길 수 밖에 없는 운동량인걸요.... 저는 한시간 반정도 웨이트하고 사십분 유산소 하는 것 같아요!! 물론 컨디션에 따라 달라지지만요 ㅎㅎ..????,두시간동안 버틸수 있는 몸과 정신이 안되네요????,저는 유산소 스트레칭 합쳐서 2시간 내외로 하는거 같아요! 원래는 3시간도 있었는데 이제 그러기엔 몸이 못버티는거 같더라고요..???,저도요ㅠ 피곤해서 조금만해야지 했다가도 가면 기본 2-3시간 하게 되는거 같아요????,이렇게 좋은 몸을 갖고계심에도 불구하고 항상 연구하고 고민하시는게 진짜 대단하십니다 ????,볼때지만 너무 견갑을 잘뽑는것 같군뇨????,간결한 운동이 2시간이군용???? 역시 쭌님은 따라갈 수가 없습니다????,우와 웨이트를 2시간 넘게 하시다니 진짜 대단하세요!! 존경존경??????,역시 파운이 안쓰던 그뉵통에 최고????,와 소리 납니다 ??????,와 렛풀 그립 변형 저도 해봐야겠습니다!????,저는 50분 정도 웨이트하고 40분 유산소해요! 2시간을 웨이트로 다 채우신다면 정말 대단하시네요..??,간결하게 한것이 이정도인가요.. 쭌님은 엄격하셔 ????????,저는 그냥 하고싶은 만큼 하는거 같아요...홈짐의 장점??,
파운 3시간이면 운동강도가 장난아니겠는걸요??,와아 네기티브 오지는 프레스군녀???? 완전 제스타일입니당????,프리와 스미스머신이 자세 차이가 없네요????,세수할 때도 쥐날 정도면 아주 운동 제대로 되셨네여! 오늘도 강력하십니당??????,벤치프레스 맛집 쭌님!!! 내일 가슴인데 쭌님 영상 보면서 연습해보겠습니다!! ????,역시 파트너 운동???? 같이 하면 시너지도 두배가되죠??,저도 파운 같이해줘용 등신 되고싶어용??????????,오우 인연이 신기하네요 ㅋㅋㅋ 구독자분도 몸이 ㅎㄷㄷ,우와 대바아아악!! 이런 인연 넘 신기하잖아요! 파운 고생하셨습니다????,"벤치츠레스의 정석.. ??쭌선생님은 팔꿈치 내회전,외회전 어떤 방식으로 받으시나요?? ??",와… 이제 헬쭌님 연예인이시네요???? 저도 만나면 사인 해주셔야해요!! 역시 강력한 사람은 강력한 분을 알아본다더니…,우와 정말 신기하네요?? 앗 그렇게 3시간을 운동하셨다니 정말 존경합니다????,아니 이두 무슨일이에요… 왜 팔에 제 허벅지를 달고 있으신거죠..???,오늘도 정자세 슬로우 모션으로 가슴 깊숙하게 잘 먹엇네요. 제가 다 뿌듯합니다. ??????,아 진짜 부럽다 저분..어디로 가면 파운할슈있나여????
너무 공감이 되요 하체 하고 나서는 너무 힘들어서 어깨는 못하겠더라구요?? 그리구 3월4일날 대회장 오세요?,ㅎㅎ 저도 브이스쿼트할때 등받이에 기대면 허리가 아파요 ㅎㅎ 고관절 유연성이나 패턴이 익숙하지 않아서 그런듯한데 저중량으로 움직임패턴 연습을 하거나.... 그냥 브이말고 스쿼트로 갈아타버립니다....??,쭌님같은 갓바디도 자세 고민을 하시는군요 ........... 근데 저도 핵스쿼트할때 등받이대면 허리가 아프던데 ㅜㅜㅜ방법찾으시면 저도 공유해주세요!!!!!! 넘 고생하셨습니다 ????,크흐 하체 스퀏트랑 레그프레스 지대로 하시는군뇨????,맞아요...스쿼트 할 때 나만의 미는 느낌이 있어야하는데..?? 저도 늘 공부중입니다요!! 우리 잘해보자구요!!,하체도 좋으시면서….저는 언제 새다리 탈출을…??,그냥 스퀏이랑 스미스스퀏이랑 둘중엔 깉은 중량대비 뭐가 더 힘들게 느껴져요??,"맞아요 하체 하면 그냥 빨리 집에 가고싶어요,,,어깨도 같이 해야지 하면 꼭 하체끝나면 집 가고싶더라구요^^….다들 똑같규나,,,,,,,",저도 핫체하면 다른 부위 추가로 하는건 진짜 불가능에 가깝더라고요…????하체 진짜 고생하셨습니다!!,스쿼트는 너무 좋은 운동인데 아직도 자세가 뭔지 모를때가 많은 거 같아요ㅠ 종류도 많구요????,ㅋㅋㅋㅋㅋㅋㅋㅋㅋㅋㅋ 하체하고 나면 아찔해져서 다음 운동 생각 안나는거 ㅇㅈㅇㅈ고관절 스트레칭하고 완전 부착해서 기대지 말고 스쿼트 자세로 해보시는건 어떨까영??? 제가보기엔 스쿼트 자세 좋으셔서 감만 잡으시면 안아프게 잘하실거같은데?????? 언능 해결하고 팁 알려주세요!,하체하고나서는 모든게 지치죠^^ 그만큼털어내고 불태웟다는뜻!!! 수고하셧습니다!!,한참을 내려가시네?????? 천천히 좋아지세여.. 못 따라가겠어여..?????,역시 여전히 미쳐버리셨군요?? 자극 뿜뿜 받고 저도 다시 열심히 해봅니다?? 저도 핵스퀏할때 허리가…??,와 스쿼트 자세 너모 좋아요 ! 흔들림없네요 부럽강 ??????
저도 인님처럼 광배 운동하면 광배가 확실하게 자극받았으면 좋겠네요ㅜ,와... 풀업 진짜 잘하시네요.. 선팔하구 갑니다!,오우 한마바키가 여기잇네????,컨디션회복 ? 매우 좋은 소식이군요 !!! 쭌님도 감기걸리지않게 조심하세용 등운동 잘보고갈게여 ???,와 등 엄청나네요?? 자극받고 갑니다!오늘도 부상없이 득근하세요????,와??진짜 광배 볼때마다 너무 부럽습니다??,볼때마다 대리만족 ????오늘도 고생하셨습니다!!,몸 지리십니다???? 근데 수행믕력도 지리셔요..,"와,,,진짜 말이 안나오네요,, 견갑 와 ㄷㄷ",오늘 저도 등어깨갑니다,크 또 눈호강하고 갑니데이??,하앍.. 등운동 진짜 찐득하게 죽입니다요??????,쭌님의 등은 역시나??역시나입니다 수고많으셨어요 ??이번주도 부상없이 득근 화이팅입니다 ??,와ㆍ. .cg같으심??????????할말을 잃게만드신다. . .,날개가 어디까지 빠지는거에요!!!!!!부럽?? ????????
크흐 몸이 좋으시니까 머슬핏입으니까 옷이 찢어질것 같군뇨????,옷이 모델 빨 받았어요 진정한 머슬핏 아니냐구요??,ㅎㅎㅎㅎ 왕팔님이 왕팔된 느낌은 뭔가요?ㅎㅎ 팔이 약한 사람이 광고해야 설득력이 있죠????,팔낑기?찡기는거. .심쿵????머슬핏이 더 빛나네요,주말에도 득근하시나요?? 즐주 보내십쇼!!??,강려크 하십니다??????머슬핏도 몸이 이리 좋아야 핏이나온다는ㅋ,이번에 받은 협찬티 시원해 보이고 좋네요!! 역시 운동하는 사람은 머슬핏 티를 입어줘여 맛이나죠 ㅋㅋㅋㅋ,쭌슨생님 덕분에 동기부여 팍팍됩니다 ??????????,와 머슬핏 반팔티 너무 잘 어울리십니다 몸이 워낙 좋으시니까 그저 찰떡 ????,ㅋㅋㅋ왕팔쭌님께서 입어주시니 팔이 더 돋보이는 티샤쓰!!!!! 색도 이쁘드앗!!,여름에 찰떡이겠어용,진짜 바디컨디선 진짜 개미쳤다 ??????,누가봐도 주고싶겟다...ㅋㅋㅋㅋㅋ??,헬쭌님이 입어서 왕팔아니냐구용??ㅋㅋㅋㅋㅋㅋ,머슬핏의 근본 이십니다…감탄띠??
최근 체중이 빠지셔서 영향이 있는 게 아닐까요?????,크흐 헬쭌님은 무척 잘됬다니 제가 다 기분이 좋아지군뇨??,역시 인기많은 이유가 있으시다니깐요 ????!! 수요고개 화이팅입니디 ?????,와 유툽도 하시고 갓생사시네용??????,와 오늘도 바디컨디션 난리나셨내요 ! 진짜머싯습미다 ???? 부족함 없어요 ??????,65키로에 이 몸이면 걍 다 씹어먹고 재패할꺼같음 크흐...????,유투브 떡상하실겁니다 ㅎㅎ,우와 천명 축하드립니다????,핏줄이 진짜 !!! 나시핏이 저런분은 쭌님밖에 못봤다구요!! 넘 고생하셨습니다 ????,피지컬이 워후..꿀팁도 많고 너무 좋습니다 소통하고싶어요!??,하루에 운동을 몇번하쉽니까??,우와 저도 구독할게용??????,우아와 핏줄이 나뭇가지처럼 뻗어져 있네요 대박??????머쉬따,하..???? 스킨이 얼마나 얇으신걸까????,
이미 강하신거 같은걸요?? 근데 중량을 어느정도는 해줘야 몸이 나온다는건 저도 그렇게 생각하는데 힘 진짜 잘 안올라가는거 같아요 스트렝스식 운동을 섞어줘야하나 싶어요,근육 외에도 인대나 건이나 관절이 적절히 쉬어줘야 되서 회복운동을 해주시면 좋지 않을까요??? 너무 고강도로 혹사하실 수 있습니다ㅠ,가슴 팔 운동 고생했어요???? 전에는 들렸던 무게가 잘 안들리는 날이 있지요?? 컨디션 차이 정말 무시 못하는거같아요?? 그래도 여전히 강력하십니다??????,오늘부터 제 꿈은 쭌님입니다…??팔이 이렇게 강력한데! 근데 어느정도 중량 쳐줘야 몸이 커진다…는 말에 동감해요…다만 제 힘이 부족할뿐??,크흐 이미 강하신데 더 강해지기위해 자가성찰하는 모습 멋지십니당????,와씨 바디컨디션 개미쳤고 플렉스 그냥 장난없네요 ㄷㄷㄷㄷ????????????,여기서 더 성장하시면 진짜 피지컬 찍으실수있을거같은데요!! 인님중에 쭌님이 최고이신데에??????,ㅈㅓ게 들어지나요? ….????,저도 중량을 너무 올리고싶은데 ㅜㅜㅜㅜ 아직 너무 나약하네요..,가슴 팔 운동 수고하셨어요 !! 진정으로 나약한건 저인걸요.. 멘탈이 약한거 같아서 어제 운동할땐 최대한 멘탈 잡고 하려고 노력했어요,크흐... 진심 볼때마다 간지작살????????,저는 쭌님처럼 강해지고 싶네여...??,크으 역시 고립은 고뇌를 부릅니다??????,지금도 강력하지만 발전하려는 모습 자체도 강력하십니닷??????,팔운동 비중은 많이 잡으시네요 ~~ 매일 팔운동을 진행하시나요 ? 그래서 팔이 좋으신건강 ㅎㅎ
제가 지금 주 5일 루틴이기는한데 가능하다면 약점 부위 주 2회 자극이 목표이고 상대적으로 강한 부위는 주 1회정도 하는것 같아요?? 쭌님이라면 조언 필요없이 본인 스타일로 하시면 될것 같네요??,앗 주5일이면 루틴돌리기가 너모 고민되는데요!!??,헬스하시는 인친님들의 아이디어가 필요하겠네요!! 그나저나 6일 돌려야 헬쭌님 몸이 되는거였네요????,"월요일은 하체죠,,?? 하지만 하체 하지 않는 저ㅎ??",월 하체 화 가슴 수 등 목 하체 금 가슴등 이렇게 돌리는것도 나쁘지 않을것같은데용???,저는 주6일~7일이지만 5일을 한다면 2분할 할 것 같습니다 ㅎㅎㅎ,4일해서 드릴 팁은 없공??잘하시니 하던대루 쭉 하시묜 될듯용??,쭌님 영상은 항상 다 끝까지 보게되네요????,월요일은 하체지만 저는 등으로…!!!???? 5분할 운동 루틴 어떻게 짜실지 궁금하군요 ???? 월요팅입니다!!,월요일부터 하체라뇨 ㅜ 진짜 고생하셨습니다 ????????,쭌님 뮬신고 간지줄줄??????화욜도 홧팅입니다????,하체 좀 알려주십시요 !!??,저는 1일 1부위 조짐니닷 ??????,흑 전 4분할로 그냥 요일@상관없이 돌리구 있어요 ㅎ,여윽시 월요일은 하체로 시작하시는 쮼님???? 정신력 배워갑니다??
스트레칭하는데 삼두가 저러면….삼두 운동끝나고 나면 어마무시하겠군요????????,삼두가 미쳤따라고 생각하고있는데 생각해보니 등 어깨하셨는데??,제가요 맨날 쭈니님 등을 탐냈었는데 오늘부터 삼두도 탐낼라구요??????,ㅋㅋㅋㅋㅋㅋㅋㅋㅋ진짜 운동이랑 상관없는데 잘나와보여서 하는거 저만 그런게 아니군용??,등운동 했지만 삼두가 미쳤네용??,크흐.. 언제봐도 강력한 바디??????????????????,운동부위 상관없는곳 찍어도 온 부위가 다 강력하셔서 그냥 쩝니다 쩔어!! ????,삼두 근질 강력하십니다???? 등 안쪽까지 조지는 스킬은 전 아직 레벨부족인걸로??,원래 상관없는곳 찍어주기,삼두가 넘나 잘 보여용!!!?? 크으... 어제보다 더 나은 바디십니당!! ???? ????,갓벽합니다??????,밀프 가동범위.. 여윽시 강력하십니다!!!,원하는대로 자극 빡빡 넣어주시는 쭌님 리스펙이에요 ??????,남은 주말도 즐겁게 보내세요????,
1kg이나 빠졌다니ㅠㅠ 그럴수가!! 다시 복구해보자구영??,"헉 저도 잠 못 자고 운동 하면 갑자기 빈혈 오더라구요ㅠ 잠 너무중요,, 주말에 푹 쉬면서 피곤함을 없애버립시당??!!",코로나 때문인건가.. 조심하셔요…아프면 운동 못하자나요!!!??,근손실 1kg… 맘 아프죠 ㅠㅠ 저도 다욧중인데 근육이 빠지고 있어요??,에구 식은땀나고 어지러울 정도면 많이 컨디션 안좋으셨던것 같은데 ㅠㅠㅠ 고생많으셨고 컨디션 빨리 회복하시기를!!,나중에 저는 머리를 잘라드릴테니 운동 좀 알려주세요??,와 진짜 저 무게 칠 수 있으면 어떤 느낌일까 ….???!!! ?????????? 해피곱창프라이데이 되셧쥬 !? ????,코휴증인가봐요ㅠ흑흑 ㅠㅠㅠ 진짜 오래가더라거요ㅠㅠ,하체하시는 것만으로 대단합니다..!????,쉴까… 할때 운동 완료하면 더 뿌듯 하죠!!!!???? 주말에도 맛있는거 잔뜩 드시고 힘내세요 !!!!??,아악 근손실이 으마으마???? 컨디션이 안좋으셨다니 .. 부상조심이요??,근손실이 아니라 수분손실이길 바랍니다ㅠ 힘 없을 땐 가리지 말고 맛있는 거 드세요??,조심히 하세요~! 몸 안좋으신데 하체라니 ㅠ 저 같으면 쉬었을건데 역시 멘탈????곱창 맛나게 드시고 회복하십쇼??,유튜브보다가 어 어디서 많이 본 등모양인데 했는데 헬쭌님 채널이더라고요 ㅋ?? 독보적인 등모양??,코로나 후유증 무조건 있어요..진짜 개뽝취는 것?? 그래도 다시 컨디션 좋아지시면 금방 강력하신 모습으로 돌아오실거에요???? 저 그리고 유튜브 알고리즘에 채널 나오셔서 매우 반가웠어요????
둘다인거 같더라구요 오랜만이라서 그렇기도하고 컨디션이 아직 다 안돌아오기도 하고.. 하지만 꾸준한신 쭌님은 금방 돌아올거에요??,후유증이 아무래두 클거같아요 ?? 그래도 시간지나면 금방 괜찮아지니까 걱정말아용!!!! 주말 잘보내세요! ????,ㅎㅎㅎㅎㅎ 삼각대 장.단점 잘봤습니다???? 챙피하지만 능력있는 녀석 ㅎㅎ;;,코로나 후유증 별거 아닌거같아도 엄청 힘들어요 ㅠㅠ 체력도 조금만 걸어도 힘들정도로 떨어졌었어서 저는 천천히 운동했던 것 같아요!! 얼른 컨디션 회복되셨으면 좋겠어요??????,와 진짜  등만 조지는 풀업~ 감탄 그자체??,제 팔이랑 바꿔주세요,ㅎㅎㅎ 충분한 재충전 시간 가진뒤 찾아온 근육통이라고 생각하시고 더 강려크해지실거라 믿습니다!! 오늘도 눈호강 제대로 합니다 ????,저 요즘 밴드 호작질 맨날 합니다 기대하라구여??????????,우워. . 등이. . .??우워. . .팔이???? 삼각대 완전 짧게 접히고 가벼운거 전 쓰는데 키는 작아요.쿠팡에서 샀는데. .,ㅋㅋㅋㅋ가방에 쏘옥 들어가야좋은뎈ㅋㅋㅋㅋㅋㅋ오늘 하체@화이팅하세요????,마지막에 스미스 머신인줄...........??,제 팔이랑 바꿀의향있으세요 ㅠㅠ 제발~~ ??,헉ㅠㅠ쭌님 코로나 걸리셨었구나ㅠㅠ어쩐지ㅠㅠ???? 아직 너무 무리하지 마시구 조심히 운동하세요????,금방 다시 원중량 찾으실겁니닷???? 화이팅이어요????,
허리저렇게 저는절대안되더라구요 몸은좀괜찮으신가용,코로나 격리해제되도 확실히 컨디션이 전같지 않더라고요..?? 저는 한달 넘게 돌아오지 않았던 기억이 ..ㅠㅠ 무리하지 말고 쉬면서 운동해요!!???? 컨디션이 젤로 중요하니까요..??,ㅜㅜㅜㅜ코로나 ㅜㅜㅜㅜㅜ그래서 안보이셨구나 ㅜㅜㅜ 고생하셨어요 ㅜㅜ 후유증없으신거죠? 건강관리 잘 하시구 개운하게 다시 운동 시작 화이팅이에요 ????,쭈니님 실례가 되지않는다면 하의 브랜드 알수있나요?스타일이 좋으셔서 궁금하구 짐웨어를 잘몰라서 여쭈어 보아요~,아.. 코로난줄도 몰랐네요?? 고생하셨어요ㅠ 우린.. 운동하기 위해 건강합니다...,그동안 했던 게 있어서 금새 회복되실 것 같슴다?? 다시 화이팅입니다 쭌님!??,운동하기 위해 건강해야한다는 말 웃프고 공감됩니다?????? 코로나 후유증 확 떨쳐버리시고 본래 컨디션 속히 되찾기를?????????????,일주일동안 격리하시면서 고생하셨습니당 ????,고생했어요~격리동안에 홈트했나용 팔이 더 커졋??ㅋㅋ,코로나 고생하셨어용????,격리해제 축하드립니다!!???? 컨디션도 어서 제대로 돌아오길????????,아이고 그동안 코로나걸리셨었구나??…규생하셨어요…다시 열심히????,와 돌아오셨군요!! 더 강력해서 돌아오신것 같아서 보기 좋습니다 ??????,고생하셨읍니다 진짜 몸 더 좋아져서 복귀하셨네요??????,아휴?? 안그래도 피드 안올라와서 궁금했는데 그분이 왔다갔군요????
아~ 헬쭌님 다니는 헬스장도 24시간이에요?? 이번에 대회 오세요?? 꼭 만나서 몸 보고 싶어요 ㅠㅠ 진심 걸어다니는 조각상 ㅠㅠ,등은 느낌으로만 알아야하니까 더 어려운거 같아요 등신 되고싶은데,와 등 움직임 미쳤네요 거의 교과서급 ㄷㄷ,오우 쭌님 유튜브도 있었네요 구독하고 배우러 가겠슴다!!??,티바로우 저두 오늘했는데 성실히 하시는 모습 보구 반성합니다??,아직 해가 안떴을때 운동 다녀오셨나 보네요!? 주위가 깜깜???? 헬쭌님 등 운동영상은 언제봐도 교과서죠 >_ㅇ,등운동은 항상 어려운거같네요ㅠㅠ,"와,,,,!쭈니쌔 내일 등 한번만 빌려주세오,,,??",곧 하늘을 날아가실 것 같은데요??? 새벽운동 다녀오셨다니 역시 최고최고????,등 운동은 자세를 볼 수 없어서 더 어려운 거 같아요. 고생하셨습니다????,새벽부터 저렇게 운동이 가능한게 일단 너무 멋진데요… 정신력이???,오늘도 인간해부도다????????,저는 아직 새벽운동 도전해본 적 없는데 주변에서 새벽운동을 엄청 추춘하시더라구요!!! 영상찍을 때 눈치 안보이는게 제일 부러운데욬ㅋㅋㅋㅋ,와 등.. 날개 날아가겠네요,
하체는 진짜 매력이죠! 힘들고 또 잘 못해도 효과가 너무 좋으니 말입니다 ??????,이미 정지 스쿼트하고 계신데요????,헬요일 하체운동 제대로 매운맛이네요 ???? 고생하셨습니다!!,국민체스트데이 피해서 하제국룰????,휴 진짜 배우고싶다구??????,고생하셨습니다.??꾸준히 화이팅??즐거운 하루 보내세요.,쥐나는데 좋다니 이건 병입니다 ??????????,스쿼트 깊이감 너무 좋으세요????,????????????,진정한 담귐이란 이런거구나 ????,????????,??,역시 고수들은 다르군요!! 무식한하체 스린이 허벅지를 치고갑니다??????,,
요즘 클라이밍 하시는 분들 많던데 재밌어보이더라구요????,첫번째 사진.. 광배가 좀 잘못된 거 같아요;;; ㄷㄷ,이게 클라이밍이쥬.. 제 피드에 박제해둔 클라이밍포스팅이 부끄러워지네요????등근육 꿀렁거리는거 대박이에요!!진짜 팔로만 버티는거 대박????,클라이밍보다 근육만 눈에 보이네요????,진짜 등근육 한번만 핥아봐도 되나여????,클라이밍까지 ㄷ ㄷ???? 매달리니 등이 더 강력하게보이는????????,"팔보고 우와 ,, 하고 육성 터졌어요?????? 클라이밍 하시는 모습 보고 또한번 자극받고 갑니다!! 남은 주말 잘 보내세요??",등에 계속 감탄사만????,와 마치 헤라클레스??????그나저나 몸이 좋으시니 운동복 협찬이 쭉쭉 들어오네용?,와...항상 쭌님 피드오면 입에서 효과음생겨요 ”와...“ ??,근육 갈라지는거 장난없어요!!??,클라이밍까지 점령하시는군요?? 와중에 그뉵 시선강탈이네요??,ㅋㅋㅋㅋ등이 이렇게 갈라지고 나올 수 있는거구나....,"너무 멋있어요??????계속 보게되는.., 예준쌤 반전매력에 빠질거 같아용 ??????",저번주에 클라이밍 했는데 진짜 힘들더라구요 ??
등 어깨를 아주 조져버리셧네요 … 저는 근육통이 조금이라도 있다 싶으면 바로 아르기닌 조져버립미다 ????,와 진짜 어깨...?? 어깨 파운 한번 하고 싶어요~ 불륨이 진짜??,티바 하실때 가슴을 좀 더 높은 위치로 올려서 해바여! 가슴이 고정되는게 아니라 움직여서 최대 가동범위가 나올때 더 잘되도라구요!ㅎㅎ,사람이 아니라구요 ㅠㅠㅠㅠ헐크 저리가라!!!!!!!! 근육통 빨리 회복하세요 쭌님 ㅜㅜ 넘 고생하셨어요 ????,등어깨하시니 윈래좋은데 더강려크????,제대로 등만쓰신게 다보이는!!????,와??갖고싶다 등??,와우.. 넘탄탄.. 넘강력..???????? 태닝하시면 데피니션 최강이실듯요??????,어깨가 무슨?? 운동소통해요??,등신께서 등운동 감을 못잡으시다늬 그럴리가여??????????????????,저도 연휴 후 쉬어서 그런지 뻐근하더라구요 다시 회복해봅시다아??,등 미쳤다 미쳤다!!!!!??,아니 무슨...어깨가 얼굴만 하십니까ㅋㅋ 와...입틀막??,누가봐도 등이랑 어깨한 사람????,
많이 먹었다면서 왜 아무 티도 안나나요?? 몸 더 좋아보이고 나시도 넘 잘 어울려여 쭈니님??,개떡이 넘 고급스킬인데요?? 몸은 더 좋아진거 같구요??,개떡이라도 리벤지성공한게 어딥니까????????????개떡이었을거같지도않지만요??,오 나시 진짜 이쁜데여?? 등운동할때도 나시 보여주세여??,오호 새로운 스트랩으로 바꾸셨군요?!! 팔운동영상 넘 잘봤습니댜!!?? 크크 오늘 등하고 시간남으면 그대로 해볼예정이에요,슈퍼세트 조아하는데 찾으로 고고??,크 같이 운동해보고싶네여ㅋㅋㅋ 웅장해집니다,왕팔 쭌님의 팔운동 루틴이라니 얼른가서 보고 담에 따라해봐야겠어요??,리벤지성공!!!!!!!!!!!축하드려요 꺅 !!!!! 눈오는날 슈퍼세트 넘 고생하셨습니다 나시도 짱 잘어울리시구!!!!! 내일도 화이팅이에요 쭌님 ????,와 역시 명절 후유증도 없이 이렇게나..????,역시 바벨과 강력한 중량만이 강려크한 팔을 만드는군뇨????????,와 하다보면 성공하리라ㅜㅜ 득근입니다,와...진짜 얼굴만한 어깨팔????피지컬100나가주세요??,크 강력크??????,순간 스미스머신인줄 알았는데 아니였네요...?? 자세 너무 좋습니다????
어제 어깨와 오늘 어깨가 또 달라보이시는걸요?? 보자마자 육성으로 와..터졌네요 진짜 대단하세요???? 명절연휴 잘 보내고 오세요??,이제 표현이 몸이 좋다가 아니라 너무 좋아서 사악하다는 표현이 맞는거 같애요 저도 오늘 고향내려가기전에 새벽운동 했어요 ㅋㅋㅋ 역시 헬스인은 어떻게든 운동을 할려고 하네요????,오와~~~???????? 멋집니다~~~????,와 금요일 등짝까지@아주 오지게 조지셨굼요 !! 고생하셨어요 !! ㅎㅎㅎㅎ 연휴에도 압도적 근성장 가보시죠 ????????,불균형은 아닌거 같고 언제봐도 아름다운 그대의 자태 ??츄릅....,불균형 맞나요?! 그저 멋집니다 ??????,와??그저감탄만???? 명절 연휴 잘보내세요,으와 등에 이렇게나 많은 근육이 있다니 를 알게 해주는 사진이네요 ????????????강력강렷,오오오옹 쭌님의 이른피드 처음 접해봐요 ?? 새벽운동 너므 고생하셨어요 맛있는거 많이먹고 행복하게 보내고오셔용!!!,틀린그림찾기가 너무 어렵네요?? 스트랩은 베르사가 가격은 나가도 가장 좋다고 하더라고요!,아니 불균형이 오딧다구..........????,와 자글자글하다.... 평상시 식단 운동강도 너무 궁금하네요??,ㅎㅐㅁ보칸 명절 보내세요~~~~??,"이젠진짜무섭습니다,,행님소리가 절로나오는?????? 명절잘보내고오세요??",네추럴 끝판왕이십니다…???? 발끝이라도 따라가볼게요??
